<?xml version="1.0" encoding="UTF-8" standalone="no"?>
<!DOCTYPE Policy SYSTEM "xml_policy.dtd">
<Policy>
<PolicyName>TestPolicy</PolicyName>
<Resolver>it.polito.policytoollib.policy.resolution.impl.FMRResolutionStrategy</Resolver>
<ExternalDataClass>java.lang.Integer</ExternalDataClass>
<DefAction>DENY</DefAction>
<Rule Action="ALLOW" Label="R1">
<ExternalDataValue>1</ExternalDataValue>
<Selector Label="Source Address">10.1.1.0-10.1.1.255</Selector>
<Selector Label="Destination Address">10.1.5.2-10.1.5.2</Selector>
<Selector Label="Source Port">80-80</Selector>
<Selector Label="Destination Port">80-80</Selector>
<Selector Label="Protocol Type">IP</Selector>
<Selector Label="L4Protocol">TCP</Selector>
<Selector Label="Http Method">GET</Selector>
<Selector Label="Direction">IN</Selector>
<Selector Label="Time">S 10:10-S 10:10</Selector>
<Selector Label="RegExp">test</Selector>
<Selector Label="StateFull">ACK</Selector>
</Rule>
<Rule Action="DENY" Label="R2">
<ExternalDataValue>1</ExternalDataValue>
<Selector Label="Source Address">10.1.1.0-10.1.1.0</Selector>
<Selector Label="Destination Address">10.1.5.2-10.1.5.2</Selector>
<Selector Label="Source Port">80-80</Selector>
<Selector Label="Destination Port">80-80</Selector>
<Selector Label="Protocol Type">IP;IPv6</Selector>
<Selector Label="L4Protocol">TCP;UDP</Selector>
<Selector Label="Http Method">GET;POST</Selector>
<Selector Label="Direction">IN;OUT</Selector>
<Selector Label="Time">S 10:10-S 10:10;M 10:10-M 12:0</Selector>
<Selector Label="RegExp">test</Selector>
<Selector Label="StateFull">ACK;SYN</Selector>
</Rule>
</Policy>
