<?xml version="1.0" encoding="UTF-8" standalone="no"?>
<!DOCTYPE Policy SYSTEM "xml_policy.dtd">
<Policy>
<PolicyName>fwB3</PolicyName>
<PolicyType>FILTERING</PolicyType>
<Resolver>it.polito.policytoollib.policy.resolution.impl.FMRResolutionStrategy</Resolver>
<ExternalDataClass>java.lang.Integer</ExternalDataClass>
<DefAction>DENY</DefAction>

<Rule Action="ALLOW" Label="fwB3_R1">
<ExternalDataValue>1</ExternalDataValue>
<Selector Label="Source Address">10.2.0.5-10.2.0.5</Selector>
<Selector Label="Destination Address">10.2.2.2-10.2.2.2</Selector>
<Selector Label="Destination Port">80-80</Selector>
</Rule>

</Policy>
