<?xml version="1.0" encoding="UTF-8" standalone="no"?>
<!DOCTYPE Policy SYSTEM "xml_policy.dtd">
<Policy>
<PolicyName>fw1</PolicyName>
<PolicyType>NAT</PolicyType>
<Resolver>it.polito.policytoollib.policy.resolution.impl.FMRResolutionStrategy</Resolver>
<ExternalDataClass>java.lang.Integer</ExternalDataClass>
<DefAction>DENY</DefAction>

<Rule Action="PRENAT" Label="fw1.PRENAT1">
<ExternalDataValue>1</ExternalDataValue>
<Selector Label="Source Address">10.0.1.0-10.0.1.255</Selector>
<Transformation>
	<Selector Label="Source Address">10.0.0.1-10.0.0.1</Selector>
</Transformation>
</Rule>

</Policy>
