<?xml version="1.0" encoding="UTF-8" standalone="no"?>
<!DOCTYPE Policy SYSTEM "xml_policy.dtd">
<Policy>
<PolicyName>fwA2</PolicyName>
<PolicyType>VPN</PolicyType>
<Resolver>it.polito.policytoollib.policy.resolution.impl.FMRResolutionStrategy</Resolver>
<ExternalDataClass>java.lang.Integer</ExternalDataClass>
<DefAction>DENY</DefAction>

<Rule Action="ESP" Label="fwA2.ESP1">
<ExternalDataValue>1</ExternalDataValue>
<Selector Label="Source Address">10.1.1.0-10.1.1.255</Selector>
<Selector Label="Destination Address">10.1.5.0-10.1.5.255</Selector>
<Transformation>
	<Selector Label="Source Address">10.1.0.5-10.1.0.5</Selector>
	<Selector Label="Destination Address">10.1.0.7-10.1.0.7</Selector>
</Transformation>
</Rule>

</Policy>
