<?xml version="1.0" encoding="UTF-8" standalone="no"?>
<!DOCTYPE Policy SYSTEM "xml_policy.dtd">
<Policy>
<PolicyName>fw2</PolicyName>
<PolicyType>FILTERING</PolicyType>
<Resolver>it.polito.policytoollib.policy.resolution.impl.FMRResolutionStrategy</Resolver>
<ExternalDataClass>java.lang.Integer</ExternalDataClass>
<DefAction>DENY</DefAction>

<Rule Action="ALLOW" Label="fw2.R1">
<ExternalDataValue>1</ExternalDataValue>
<Selector Label="Destination Port">12-12</Selector>
<Selector Label="Source Address">10.0.1.0-10.0.1.255</Selector>
<Selector Label="Destination Address">10.0.2.12-10.0.2.12</Selector>
</Rule>


</Policy>
