<?xml version="1.0" encoding="UTF-8" standalone="no"?>
<!DOCTYPE Policy SYSTEM "xml_policy.dtd">
<Policy>
<PolicyName>fwC1</PolicyName>
<PolicyType>FILTERING</PolicyType>
<Resolver>it.polito.policytoollib.policy.resolution.impl.FMRResolutionStrategy</Resolver>
<ExternalDataClass>java.lang.Integer</ExternalDataClass>
<DefAction>DENY</DefAction>

<Rule Action="ALLOW" Label="fwC1_R1">
<ExternalDataValue>1</ExternalDataValue>
<Selector Label="Source Address">10.1.0.1-10.1.0.1</Selector>
<Selector Label="Destination Address">10.3.0.6-10.3.0.6</Selector>
</Rule>

<Rule Action="ALLOW" Label="fwC1_R2">
<ExternalDataValue>2</ExternalDataValue>
<Selector Label="Source Address">10.1.1.0-10.1.1.255</Selector>
<Selector Label="Destination Address">10.2.2.2-10.2.2.2</Selector>
<Selector Label="Destination Port">80-80</Selector>
</Rule>

</Policy>
